{
  "$schema": "https://json-schema.org/draft/2020-12/schema",
  "$id": "https://j7an.github.io/cross-agent-reviews/schema/v1/round-audit.json",
  "title": "RoundAudit",
  "type": "object",
  "additionalProperties": false,
  "required": [
    "round", "stage", "schema_version", "slug",
    "artifact_type", "artifact_path", "emitted_at",
    "slice_plan", "agents"
  ],
  "properties": {
    "round": {"type": "integer", "enum": [1, 2, 3]},
    "stage": {"type": "string", "enum": ["1a", "2a", "3a"]},
    "schema_version": {"const": 1},
    "slug": {"type": "string", "pattern": "^[A-Za-z0-9._-]+$"},
    "artifact_type": {"type": "string", "enum": ["spec", "plan"]},
    "artifact_path": {"type": "string", "minLength": 1},
    "emitted_at": {"type": "string", "pattern": "^\\d{4}-\\d{2}-\\d{2}T\\d{2}:\\d{2}:\\d{2}Z$"},
    "slice_plan": {"type": "array", "minItems": 1, "items": {"$ref": "#/$defs/slice_entry"}},
    "agents": {"type": "array", "minItems": 1, "items": {"$ref": "#/$defs/agent_entry"}}
  },
  "allOf": [
    {
      "if": {"properties": {"stage": {"const": "1a"}}},
      "then": {"properties": {"round": {"const": 1}}}
    },
    {
      "if": {"properties": {"stage": {"const": "2a"}}},
      "then": {"properties": {"round": {"const": 2}}}
    },
    {
      "if": {"properties": {"stage": {"const": "3a"}}},
      "then": {"properties": {"round": {"const": 3}}}
    },
    {
      "if": {"properties": {"stage": {"const": "1a"}}},
      "then": {
        "properties": {
          "agents": {
            "items": {
              "properties": {
                "status": {"enum": ["findings_found", "clean"]},
                "findings": {"items": {"properties": {"severity": {"enum": ["blocker", "gap", "nit", "false_positive_check"]}}}},
                "round_1_verifications": {"maxItems": 0}
              }
            }
          }
        }
      }
    },
    {
      "if": {"properties": {"stage": {"const": "2a"}}},
      "then": {
        "properties": {
          "agents": {
            "items": {
              "properties": {
                "status": {"enum": ["verified", "issues_found"]},
                "findings": {"items": {"properties": {"severity": {"enum": ["blocker", "gap"]}}}}
              }
            }
          }
        }
      }
    },
    {
      "if": {"properties": {"stage": {"const": "3a"}}},
      "then": {
        "properties": {
          "agents": {
            "items": {
              "properties": {
                "status": {"enum": ["ship_ready", "blocker_found"]},
                "findings": {"items": {"properties": {"severity": {"const": "blocker"}}}},
                "round_1_verifications": {"maxItems": 0}
              }
            }
          }
        }
      }
    },
    {
      "properties": {
        "agents": {
          "items": {
            "allOf": [
              {
                "if": {"properties": {"status": {"enum": ["clean", "verified", "ship_ready"]}}},
                "then": {"properties": {"findings": {"maxItems": 0}}}
              },
              {
                "if": {"properties": {"status": {"enum": ["findings_found", "issues_found", "blocker_found"]}}},
                "then": {"properties": {"findings": {"minItems": 1}}}
              },
              {
                "if": {"properties": {"agent_id": {"const": 6}}},
                "then": {
                  "properties": {
                    "findings": {"items": {"properties": {"severity": {"const": "blocker"}}}}
                  }
                }
              }
            ]
          }
        }
      }
    }
  ],
  "$defs": {
    "slice_entry": {
      "type": "object",
      "additionalProperties": false,
      "required": ["agent_id", "concern", "slice_definition", "is_fixed"],
      "properties": {
        "agent_id": {"type": "integer", "minimum": 1, "maximum": 6},
        "concern": {"type": "string", "minLength": 1},
        "slice_definition": {"type": "string", "minLength": 1},
        "is_fixed": {"type": "boolean"}
      }
    },
    "agent_entry": {
      "type": "object",
      "additionalProperties": false,
      "required": ["agent_id", "concern", "slice_definition", "status", "findings", "round_1_verifications"],
      "properties": {
        "agent_id": {"type": "integer", "minimum": 1, "maximum": 6},
        "concern": {"type": "string"},
        "slice_definition": {"type": "string"},
        "status": {"type": "string"},
        "findings": {"type": "array", "items": {"$ref": "https://j7an.github.io/cross-agent-reviews/schema/v1/finding.json"}},
        "round_1_verifications": {"type": "array", "items": {"$ref": "https://j7an.github.io/cross-agent-reviews/schema/v1/verification.json"}}
      }
    }
  }
}
